{
  "protocolVersion": "1.0",
  "sessionId": "session-example-01",
  "instanceId": "instance-graphical-01",
  "instanceNonce": "instance_nonce_example_123456789012345678",
  "jobId": "job-example-17",
  "artifactId": "artifact-example-17",
  "relativeScreenshotFilename": "job-example-17.bmp",
  "screenshotIssuedAt": "2026-07-16T20:00:10.000Z",
  "completedAt": "2026-07-16T20:00:11.000Z",
  "expectedByteCount": 921654,
  "worldId": "world-example-01",
  "worldEpoch": 1,
  "actualCamera": { "position": [100, 25, 200], "orientation": [0, 0, 0, 1] },
  "actualFov": 60,
  "requestedSettleFrames": 3,
  "actualSettleFrames": 3,
  "contaminated": false,
  "warnings": []
}
